{
  "schemaVersion": "sacs-closure-decision/1.0",
  "track": "V0_5",
  "decision": "BLOCKED_PREREQUISITE",
  "sourceSha": "718963d9a2d1bb88be8ee5f9b41b2f7345d30d7c",
  "acceptance": {
    "required": 165,
    "pass": 0,
    "fail": 0,
    "notRun": 85,
    "blocked": 80
  },
  "blockers": [
    "SACS_V04_GEOSPATIAL_EXPLANATION_BASELINE_NOT_READY",
    "SACS_WSGS_ANALYSIS_HANDOFF_NOT_READY",
    "ROW_LEVEL_LOCAL_AND_REAL_QUALIFICATION_NOT_RUN"
  ],
  "nonClaims": [
    "The historical v0.5 aggregate test report is supplementary and is not per-acceptance exact-head evidence.",
    "No real WSGS analysis plan, event, revision, cancel, intervention, or recovery chain is claimed.",
    "DEVELOPMENT_READY_BLOCKED_LIVE is not claimed while local required rows remain NOT_RUN."
  ],
  "pullRequest": {
    "number": 18,
    "state": "DRAFT",
    "baseBranch": "codex/sacs-v0.4-geospatial-explanation",
    "headBranch": "codex/sacs-v0.5-observer-first-interactive-analysis",
    "headSha": "718963d9a2d1bb88be8ee5f9b41b2f7345d30d7c",
    "exactHeadCi": "PASS",
    "protectedActionsPerformed": [
      "PUSH",
      "PULL_REQUEST_CREATE_OR_UPDATE"
    ],
    "closureReportCommitIsQualificationSource": false
  }
}
